"Company Management SAN","RedHat","RedHat Enterprise Linux","RHEL 5.0"
"3.2.3  Bulk Data Storage Rack","","",""
"The Bulk Data Storage Rack is illustrated in Figure 3.2.3-1, and it contains multiple Dell PowerVault Storage Area","","",""
"Network (SAN) units. This rack provides the archive storage the facility engineering and production, test engineering,","","",""
"IT and cybersecurity, and company management work areas.  The IT cybersecurity data will be encrypted at rest on","","",""
"dedicated SANS drives.  The company products technical data and test data assessed as sensitive Intellectual Property","","",""
"data  and  any  other  company  sensitive  data  will  be  encrypted  at  rest  and  stored  on  dedicated  SANS  drives.    The","","",""
"company also implements automatic archive replication to a backup SANS within the same equipment rack in the","","",""
"event of the primary archive failure.  The SANS storage on the rack includes:","","",""
